{
  "generated_at": "2026-05-03T11:58:47Z",
  "git_sha": null,
  "builders": {
    "build_eda_views": {
      "version": "0.1.0",
      "status": "implemented",
      "script_path": "data-pipeline/build_eda_views.py",
      "ran_at": null,
      "duration_s": null
    },
    "build_groupings": {
      "version": "0.1.0",
      "status": "partial",
      "script_path": "data-pipeline/build_groupings.py",
      "ran_at": null,
      "duration_s": null
    },
    "build_representations": {
      "version": "0.1.0",
      "status": "partial",
      "script_path": "data-pipeline/build_representations.py",
      "ran_at": null,
      "duration_s": null
    },
    "build_quantization_views": {
      "version": "0.1.0",
      "status": "partial",
      "script_path": "data-pipeline/build_quantization_views.py",
      "ran_at": null,
      "duration_s": null
    },
    "build_wordifications": {
      "version": "0.1.0",
      "status": "partial",
      "script_path": "data-pipeline/build_wordifications.py",
      "ran_at": null,
      "duration_s": null
    },
    "build_lda_sweep": {
      "version": "0.1.0",
      "status": "planned",
      "script_path": "data-pipeline/build_lda_sweep.py",
      "ran_at": null,
      "duration_s": null
    },
    "build_lda_canonical_fits": {
      "version": "0.1.0",
      "status": "planned",
      "script_path": "data-pipeline/build_lda_canonical_fits.py",
      "ran_at": null,
      "duration_s": null
    },
    "build_topic_views": {
      "version": "0.1.0",
      "status": "planned",
      "script_path": "data-pipeline/build_topic_views.py",
      "ran_at": null,
      "duration_s": null
    },
    "build_topic_to_data": {
      "version": "0.1.0",
      "status": "planned",
      "script_path": "data-pipeline/build_topic_to_data.py",
      "ran_at": null,
      "duration_s": null
    },
    "build_topic_to_library": {
      "version": "0.1.0",
      "status": "partial",
      "script_path": "data-pipeline/build_topic_to_library.py",
      "ran_at": null,
      "duration_s": null
    },
    "build_cross_method_agreement": {
      "version": "0.1.0",
      "status": "planned",
      "script_path": "data-pipeline/build_cross_method_agreement.py",
      "ran_at": null,
      "duration_s": null
    },
    "build_method_statistics": {
      "version": "0.1.0",
      "status": "partial",
      "script_path": "data-pipeline/build_method_statistics.py",
      "ran_at": null,
      "duration_s": null
    },
    "build_spatial_validation": {
      "version": "0.1.0",
      "status": "planned",
      "script_path": "data-pipeline/build_spatial_validation.py",
      "ran_at": null,
      "duration_s": null
    },
    "build_external_validation": {
      "version": "0.1.0",
      "status": "partial",
      "script_path": "data-pipeline/build_external_validation.py",
      "ran_at": null,
      "duration_s": null
    },
    "build_spectral_browser": {
      "version": "0.1.0",
      "status": "planned",
      "script_path": "data-pipeline/build_spectral_browser.py",
      "ran_at": null,
      "duration_s": null
    },
    "build_spectral_density": {
      "version": "0.1.0",
      "status": "planned",
      "script_path": "data-pipeline/build_spectral_density.py",
      "ran_at": null,
      "duration_s": null
    },
    "build_narratives": {
      "version": "0.1.0",
      "status": "planned",
      "script_path": "data-pipeline/build_narratives.py",
      "ran_at": null,
      "duration_s": null
    },
    "build_interpretability": {
      "version": "0.1.0",
      "status": "planned",
      "script_path": "data-pipeline/build_interpretability.py",
      "ran_at": null,
      "duration_s": null
    },
    "build_validation_blocks": {
      "version": "0.1.0",
      "status": "partial",
      "script_path": "data-pipeline/build_validation_blocks.py",
      "ran_at": null,
      "duration_s": null
    },
    "curate_for_web": {
      "version": "0.1.0",
      "status": "implemented",
      "script_path": "data-pipeline/curate_for_web.py",
      "ran_at": "2026-05-03T11:58:47Z",
      "duration_s": 0.0
    }
  },
  "scenes": [
    {
      "id": "indian-pines-corrected",
      "n_pixels": 21025,
      "n_labelled": 10249,
      "wavelengths_present": true
    },
    {
      "id": "salinas-corrected",
      "n_pixels": 111104,
      "n_labelled": 54129,
      "wavelengths_present": true
    },
    {
      "id": "salinas-a-corrected",
      "n_pixels": 7138,
      "n_labelled": 5348,
      "wavelengths_present": true
    },
    {
      "id": "cuprite-aviris-reflectance",
      "n_pixels": 314368,
      "n_labelled": 314368,
      "wavelengths_present": true
    },
    {
      "id": "pavia-university",
      "n_pixels": 207400,
      "n_labelled": 42776,
      "wavelengths_present": true
    },
    {
      "id": "kennedy-space-center",
      "n_pixels": 314368,
      "n_labelled": 5211,
      "wavelengths_present": true
    },
    {
      "id": "botswana",
      "n_pixels": 377856,
      "n_labelled": 3248,
      "wavelengths_present": true
    },
    {
      "id": "samson-unmixing-roi",
      "n_pixels": 9025,
      "n_labelled": 9025,
      "wavelengths_present": true
    },
    {
      "id": "jasper-ridge-unmixing-roi",
      "n_pixels": 10000,
      "n_labelled": 10000,
      "wavelengths_present": true
    },
    {
      "id": "urban-unmixing-roi",
      "n_pixels": 94249,
      "n_labelled": 94249,
      "wavelengths_present": true
    }
  ],
  "artifacts": [
    {
      "id": "analysis.analysis",
      "path": "data/derived/analysis/analysis.json",
      "format": "json",
      "bytes": 166063,
      "schema": null,
      "input_hash": "sha256:104d6b0c3c6126053cad4fcd04f2e47dadd4eeae57894bbe3e85176991f82633"
    },
    {
      "id": "baselines.previews.cuprite-aviris-reflectance-slic",
      "path": "data/derived/baselines/previews/cuprite-aviris-reflectance-slic.png",
      "format": "png",
      "bytes": 2857,
      "schema": null,
      "input_hash": "sha256:aa20c95888a16409326cbd8d55977646048ebff8ed9ed6452cf53d610cb6850b"
    },
    {
      "id": "baselines.previews.indian-pines-corrected-slic",
      "path": "data/derived/baselines/previews/indian-pines-corrected-slic.png",
      "format": "png",
      "bytes": 809,
      "schema": null,
      "input_hash": "sha256:e52c8a52b4ad18262d48c0b4b0ff68ddebe2bc2bc585a4dafa338d00afca47ba"
    },
    {
      "id": "baselines.previews.salinas-a-corrected-slic",
      "path": "data/derived/baselines/previews/salinas-a-corrected-slic.png",
      "format": "png",
      "bytes": 582,
      "schema": null,
      "input_hash": "sha256:b0a664c5a19838ceb4e4eb39d4928dd1f8645c0bdf2aff193bbb001442e42ab5"
    },
    {
      "id": "baselines.segmentation_baselines",
      "path": "data/derived/baselines/segmentation_baselines.json",
      "format": "json",
      "bytes": 10315,
      "schema": null,
      "input_hash": "sha256:0c7ab69865c78b95daa2da70f7e4b9401dd728b1d2319787e2b95a8bf9d133a8"
    },
    {
      "id": "core.hidsag_band_quality",
      "path": "data/derived/core/hidsag_band_quality.json",
      "format": "json",
      "bytes": 453927,
      "schema": null,
      "input_hash": "sha256:a2d61fef1a7296b9ade8b81f27d792110ac538166dc6ec6ce933c6bfaf7c66b1"
    },
    {
      "id": "core.hidsag_curated_subset",
      "path": "data/derived/core/hidsag_curated_subset.json",
      "format": "json",
      "bytes": 52368050,
      "schema": null,
      "input_hash": "sha256:973f748bc3fbbe8072cbb9625b19491f1f446721177c014ba4b78cda5f66279b"
    },
    {
      "id": "core.hidsag_preprocessing_sensitivity",
      "path": "data/derived/core/hidsag_preprocessing_sensitivity.json",
      "format": "json",
      "bytes": 467471,
      "schema": null,
      "input_hash": "sha256:0a6597d5c3cc3f1fc0f42ea8d74e6a75cb867397a087b82bf02402488a66a843"
    },
    {
      "id": "core.hidsag_region_documents",
      "path": "data/derived/core/hidsag_region_documents.json",
      "format": "json",
      "bytes": 42370,
      "schema": null,
      "input_hash": "sha256:2525cb75dcbe1f4225a10657afe47502d222ff41abd3290c211d93e5d28953dd"
    },
    {
      "id": "core.hidsag_region_documents",
      "path": "data/derived/core/hidsag_region_documents.npz",
      "format": "npz",
      "bytes": 23255237,
      "schema": null,
      "input_hash": "sha256:111b6903bbee70b1e1a602d39cad92b1e74884aef352d61a26ce67c25808a847"
    },
    {
      "id": "core.hidsag_subset_inventory",
      "path": "data/derived/core/hidsag_subset_inventory.json",
      "format": "json",
      "bytes": 63760,
      "schema": null,
      "input_hash": "sha256:ff83b6fdd5b20910c49c6955bb3c90908d8ae1d66fab6bbd92d7f3d7dbee55f1"
    },
    {
      "id": "core.local_core_benchmarks",
      "path": "data/derived/core/local_core_benchmarks.json",
      "format": "json",
      "bytes": 2021411,
      "schema": null,
      "input_hash": "sha256:f56ff79180396ebee043e1d4ea9d1290dbbeb646728a684ff7e1980a515c854d"
    },
    {
      "id": "core.local_dataset_inventory",
      "path": "data/derived/core/local_dataset_inventory.json",
      "format": "json",
      "bytes": 53798,
      "schema": null,
      "input_hash": "sha256:cbff2d92d08f6e670b00fe3e813e72b4e6a80a4805c785271d844ead9cbb13c2"
    },
    {
      "id": "corpus.corpus_previews",
      "path": "data/derived/corpus/corpus_previews.json",
      "format": "json",
      "bytes": 32388,
      "schema": null,
      "input_hash": "sha256:55eee9fefaa139303d9c3952a119e87462fd5c67970d447bbd00493e675c2a01"
    },
    {
      "id": "eda.per_scene.botswana",
      "path": "data/derived/eda/per_scene/botswana.json",
      "format": "json",
      "bytes": 309473,
      "schema": "output-schemas/eda_per_scene.schema.json",
      "input_hash": "sha256:032f06ffb6599639aae73869c6343df2d9df37ae21115f61d25208097c7ae657"
    },
    {
      "id": "eda.per_scene.cuprite-aviris-reflectance",
      "path": "data/derived/eda/per_scene/cuprite-aviris-reflectance.json",